### ISSUE TITLE
Doesn't seem to listen on IPv6 multicast address

### ISSUE THREAD

**Issue by HeMan** [cnlohr/minimdnsd#7]
Sending AAAA queries to the multicast address `ff02::fb` doesn't work, but sending to any of the unicast addresses makes it respond with that unicast address.

Sending to multicast address:
```
23:25:55.829464 IP6 fd12:3456:789a:bcde:d9e0:d7f9:c40f:6297.5353 > ff02::fb.5353: 0 AAAA (QM)? suxhost.local. (31)
23:25:56.830988 IP6 fd12:3456:789a:bcde:d9e0:d7f9:c40f:6297.5353 > ff02::fb.5353: 0 AAAA (QM)? suxhost.local. (31)
23:25:58.833740 IP6 fd12:3456:789a:bcde:d9e0:d7f9:c40f:6297.5353 > ff02::fb.5353: 0 AAAA (QM)? suxhost.local. (31)
```

Sending to unicast address:
```
23:26:40.855217 IP6 fd12:3456:789a:bcde:7a18:91c0:c6d8:90f2.58009 > fd12:3456:789a:bcde:be24:11ff:fec8:646.5353: 60633+ [1au] AAAA (QM)? suxhost.local. (54)
23:26:40.857751 IP6 fd12:3456:789a:bcde:be24:11ff:fec8:646.5353 > fd12:3456:789a:bcde:7a18:91c0:c6d8:90f2.58009: 55788*- [0q] 1/0/0 (Cache flush) AAAA fd12:3456:789a:bcde:be24:11ff:fec8:646 (53)
```

**Comment by cnlohr** [comment]
How did you test? I.e. what mechanism did you do to request IPv6 MDNS?  I wasn't able to find any direct mechanism, so I resorted to `nc`

**Comment by HeMan** [comment]
Avahi does some kind of happy eyeball where it sends to both the IPv4 multicast address and the IPv6 multicast address. I tested with with no IPv4 address on the host running minimdns, otherwise it was answering over IPv4.
The actual request, when dumping both IPv4 and IPv6, looks like this:
```
07:03:28.104881 IP6 fd12:3456:789a:bcde:d9e0:d7f9:c40f:6297.5353 > ff02::fb.5353: 0 AAAA (QM)? suxhost.local. (31)
07:03:28.104925 IP 192.168.2.23.5353 > 224.0.0.251.5353: 0 AAAA (QM)? suxhost.local. (31)
07:03:29.106721 IP6 fd12:3456:789a:bcde:d9e0:d7f9:c40f:6297.5353 > ff02::fb.5353: 0 AAAA (QM)? suxhost.local. (31)
07:03:29.106773 IP 192.168.2.23.5353 > 224.0.0.251.5353: 0 AAAA (QM)? suxhost.local. (31)
07:03:31.108419 IP6 fd12:3456:789a:bcde:d9e0:d7f9:c40f:6297.5353 > ff02::fb.5353: 0 AAAA (QM)? suxhost.local. (31)
07:03:31.108467 IP 192.168.2.23.5353 > 224.0.0.251.5353: 0 AAAA (QM)? suxhost.local. (31)
```

To do unicast request I used dig, however, dig doesn't seem to like the response and doesn't show it due to some ID missmatch so the only way to see the response is via tcpdump and friends
```
$ dig @fd12:3456:789a:bcde:be24:11ff:fec8:646 -p 5353 suxhost.local -t AAAA
;; Warning: ID mismatch: expected ID 27559, got 42859
;; communications error to fd12:3456:789a:bcde:be24:11ff:fec8:646#5353: timed out
;; Warning: ID mismatch: expected ID 27559, got 42859
;; communications error to fd12:3456:789a:bcde:be24:11ff:fec8:646#5353: timed out
;; Warning: ID mismatch: expected ID 27559, got 42859
;; communications error to fd12:3456:789a:bcde:be24:11ff:fec8:646#5353: timed out
```
